{
  "request_id": "req_lb_007",
  "case_id": "case_007",
  "trace_id": "trace_007",
  "api_version": "1.0",
  "responder_module": "B21_ReportGenerator",
  "status": "SUCCESS_WITH_WARNINGS",
  "payload": {
    "sources": [
      {
        "source_id": "src_tuel_267_2000",
        "uri_ufficiale": "https://www.normattiva.it/uri-res/N2Ls?urn:nir:stato:decreto.legislativo:2000-08-18;267"
      }
    ],
    "norm_units": [
      {
        "norm_unit_id": "art_176_comma_1"
      }
    ],
    "citations_valid": [
      {
        "citation_id": "cit_001",
        "atto_tipo": "D.Lgs.",
        "atto_numero": "267",
        "atto_anno": "2000",
        "articolo": "176",
        "comma": "1",
        "uri_ufficiale": "https://www.normattiva.it/uri-res/N2Ls?urn:nir:stato:decreto.legislativo:2000-08-18;267",
        "stato_vigenza": "VIGENTE_VERIFICATA",
        "citation_status": "VALID"
      }
    ],
    "audit": {
      "events_present": true,
      "audit_event_count": 3,
      "critical_nodes_logged": true,
      "missing_nodes": []
    },
    "shadow": {
      "executed_modules": [
        "B10_HybridRetriever",
        "B15_CitationBuilder",
        "B19_AuditLogger",
        "B20_ShadowTracer"
      ],
      "retrieval_queries": [
        "fondo di riserva art. 176 tuel"
      ],
      "filters_applied": [
        "domain=tuel",
        "source_authoritative=true"
      ],
      "documents_seen": [
        "src_tuel_267_2000"
      ],
      "norm_units_seen": [
        "art_176_comma_1"
      ],
      "warnings": [
        "coverage_notice"
      ],
      "errors": [],
      "blocks": [],
      "decision_points": [
        "retrieval_completed",
        "citation_validated",
        "warning_emitted"
      ],
      "technical_notes": [
        "supporto documentale non conclusivo"
      ]
    },
    "support_only_flag": true,
    "technical_report": {
      "report_type": "documentary_support"
    },
    "coverage": {
      "coverage_score": 0.94,
      "coverage_status": "NEAR_COMPLETE",
      "critical_gap_flag": false,
      "missing_sources": [],
      "missing_crossrefs": []
    }
  },
  "warnings": [
    {
      "code": "COVERAGE_NOTICE",
      "message": "Coverage non piena ma senza blocchi aperti.",
      "pointer": "/payload/coverage",
      "module": "B12_CoverageEstimator"
    }
  ],
  "errors": [],
  "blocks": [],
  "timestamp": "2026-03-18T09:14:00Z"
}